{"actor":{"actor_id":"fossil-agent-engineering-importer-v1","actor_type":"importer","harness_version":"fossil-core-local-import-v1","model_id":null,"skill_id":"skill_research-ingestion","skill_version":"1.0.0"},"event_id":"evt_645a0d726d650b4833f744fea5c90d7e","event_type":"claim.proposed","evidence_refs":["art_0ec8dbecf87951c91b7f196776a33167"],"idempotency_key":"claim-proposed:lin_fossil_agent_engineering_20260816:ln_fossil_handoff_observation_001","occurred_at":"2026-08-16T00:00:00Z","pack_id":"pack_fossil_agent_engineering_20260816","payload":{"applicability_scope":{"surface":"historical operational handoff"},"authority_state":"candidate_only","citation":{"artifact_id":"art_0ec8dbecf87951c91b7f196776a33167","byte_end":4618,"byte_start":4537,"citation_id":"cite_05c3d0136b7d6ce0911d5317","passage_hash":{"algorithm":"sha256","digest":"cc1bc96971edbae304f916e875de050892e71ef648c2c4b0ec6a217d65d30163"},"schema_version":"fossil.citation.v1","snapshot_id":"snap_6b022ba69fa4eb1af63b726c"},"claim_text":"The conversation reports a historical R2/main-branch handoff state","conversation_id":"conv_fossil_agent_engineering_20260816","epistemic_class":"repo_observation","evidence_status":"reconstructed","kind":"observation","lineage_id":"lin_fossil_agent_engineering_20260816","lineage_node_id":"ln_fossil_handoff_observation_001","operational_state":"candidate","position_state":"historical"},"provenance":{"benchmark_ref":"examples/conversation-lineage/fossil-agent-engineering-substrate-v1.json","method":"reconstructed-conversation-lineage-import","ontology_version":"dkg.core@1.x","software_commit":null},"recorded_at":"2026-08-16T00:00:00Z","schema_version":"dkg.event.v1","source_snapshot_refs":["snap_6b022ba69fa4eb1af63b726c"],"subject_refs":["clm_fossil_agent_engineering_handoff_observation_001"]}
