{"actor":{"actor_id":"time-to-crawl-scope-importer-v1","actor_type":"importer","harness_version":"fossil-core-local-import-v1","model_id":null,"skill_id":"skill_research-ingestion","skill_version":"1.0.0"},"event_id":"evt_73155960e85be5f82f3d015ce8fca142","event_type":"claim.proposed","evidence_refs":["art_3a50d9aab02a8f1765b5b118f6601671"],"idempotency_key":"claim-proposed:lin_time_to_crawl_scope_20260816:ln_time_scope_001","occurred_at":"2026-08-16T00:00:00Z","pack_id":"pack_time_to_crawl_scope_20260816","payload":{"applicability_scope":{"project":"time-to-crawl"},"authority_state":"candidate_only","citation":{"artifact_id":"art_3a50d9aab02a8f1765b5b118f6601671","byte_end":1369,"byte_start":1315,"citation_id":"cite_e3a44f1a5b94d1c17761d3e8","passage_hash":{"algorithm":"sha256","digest":"3ff4afd4c20071c7179199a71de70af400b9266d6e0b467d8916c68e10f980b1"},"schema_version":"fossil.citation.v1","snapshot_id":"snap_111c06b794cbc9aea14f5868"},"claim_text":"Time to Crawl is a modular deal-intelligence monolith with Merchant Scout and Deal Finder subsystems","conversation_id":"conv_time_to_crawl_scope_20260816","epistemic_class":"architectural_synthesis","evidence_status":"reconstructed","kind":"decision","lineage_id":"lin_time_to_crawl_scope_20260816","lineage_node_id":"ln_time_scope_001","operational_state":"proposed","position_state":"current"},"provenance":{"benchmark_ref":"examples/conversation-lineage/time-to-crawl-v1.json","method":"reconstructed-conversation-lineage-import","ontology_version":"dkg.core@1.x","software_commit":null},"recorded_at":"2026-08-16T00:00:00Z","schema_version":"dkg.event.v1","source_snapshot_refs":["snap_111c06b794cbc9aea14f5868"],"subject_refs":["clm_time_to_crawl_scope_001"]}
