{"actor":{"actor_id":"fossil-agent-engineering-importer-v1","actor_type":"importer","harness_version":"fossil-core-local-import-v1","model_id":null,"skill_id":"skill_research-ingestion","skill_version":"1.0.0"},"event_id":"evt_3199a8a26fa446a57c9c2480a47a096f","event_type":"claim.proposed","evidence_refs":["art_0ec8dbecf87951c91b7f196776a33167"],"idempotency_key":"claim-proposed:lin_fossil_agent_engineering_20260816:ln_fossil_intent_broker_001","occurred_at":"2026-08-16T00:00:00Z","pack_id":"pack_fossil_agent_engineering_20260816","payload":{"applicability_scope":{"surface":"requirements elicitation and implementation entry"},"authority_state":"candidate_only","citation":{"artifact_id":"art_0ec8dbecf87951c91b7f196776a33167","byte_end":1742,"byte_start":1678,"citation_id":"cite_e6c475a7f4c2d2c04aa56ce4","passage_hash":{"algorithm":"sha256","digest":"7c429478728b3afb4135622f95b3fefbe5c119f075a3a159c5f299aab6fe529d"},"schema_version":"fossil.citation.v1","snapshot_id":"snap_6b022ba69fa4eb1af63b726c"},"claim_text":"Place an Intent/Requirements Broker before implementation","conversation_id":"conv_fossil_agent_engineering_20260816","epistemic_class":"architectural_synthesis","evidence_status":"reconstructed","kind":"decision","lineage_id":"lin_fossil_agent_engineering_20260816","lineage_node_id":"ln_fossil_intent_broker_001","operational_state":"proposed","position_state":"current"},"provenance":{"benchmark_ref":"examples/conversation-lineage/fossil-agent-engineering-substrate-v1.json","method":"reconstructed-conversation-lineage-import","ontology_version":"dkg.core@1.x","software_commit":null},"recorded_at":"2026-08-16T00:00:00Z","schema_version":"dkg.event.v1","source_snapshot_refs":["snap_6b022ba69fa4eb1af63b726c"],"subject_refs":["clm_fossil_agent_engineering_intent_broker_001"]}
