{"actor":{"actor_id":"fossil-agent-engineering-importer-v1","actor_type":"importer","harness_version":"fossil-core-local-import-v1","model_id":null,"skill_id":"skill_research-ingestion","skill_version":"1.0.0"},"event_id":"evt_9e0a42137fe510d8ef75dc0b93eeebd0","event_type":"claim.proposed","evidence_refs":["art_0ec8dbecf87951c91b7f196776a33167"],"idempotency_key":"claim-proposed:lin_fossil_agent_engineering_20260816:ln_fossil_live_gap_001","occurred_at":"2026-08-16T00:00:00Z","pack_id":"pack_fossil_agent_engineering_20260816","payload":{"applicability_scope":{"surface":"live GitHub, CI, and R2 verification"},"authority_state":"candidate_only","citation":{"artifact_id":"art_0ec8dbecf87951c91b7f196776a33167","byte_end":4699,"byte_start":4619,"citation_id":"cite_6217d9d7ca3113d0cd50814d","passage_hash":{"algorithm":"sha256","digest":"bf7eecc0d74cab71d2775f4d6d62962ae2e4f12ed7e6ee59439f0f977521a3b1"},"schema_version":"fossil.citation.v1","snapshot_id":"snap_6b022ba69fa4eb1af63b726c"},"claim_text":"Historical handoff claims require live repository and workflow verification","conversation_id":"conv_fossil_agent_engineering_20260816","epistemic_class":"challenge","evidence_status":"reconstructed","kind":"challenge","lineage_id":"lin_fossil_agent_engineering_20260816","lineage_node_id":"ln_fossil_live_gap_001","operational_state":"candidate","position_state":"unresolved"},"provenance":{"benchmark_ref":"examples/conversation-lineage/fossil-agent-engineering-substrate-v1.json","method":"reconstructed-conversation-lineage-import","ontology_version":"dkg.core@1.x","software_commit":null},"recorded_at":"2026-08-16T00:00:00Z","schema_version":"dkg.event.v1","source_snapshot_refs":["snap_6b022ba69fa4eb1af63b726c"],"subject_refs":["clm_fossil_agent_engineering_live_gap_001"]}
