{"actor":{"actor_id":"time-to-crawl-scope-importer-v1","actor_type":"importer","harness_version":"fossil-core-local-import-v1","model_id":null,"skill_id":"skill_research-ingestion","skill_version":"1.0.0"},"caused_by_event_ids":["evt_9740504bb42211007cfe7200b556736f","evt_6b58c83282c55101e5bcdb792acec872"],"event_id":"evt_ef60008c435845f097bc880f78e5253a","event_type":"relation.proposed","evidence_refs":["art_3a50d9aab02a8f1765b5b118f6601671"],"idempotency_key":"relation-proposed:lin_time_to_crawl_scope_20260816:le_time_boundaries_storage","occurred_at":"2026-08-16T00:00:00Z","pack_id":"pack_time_to_crawl_scope_20260816","payload":{"authority_state":"candidate_only","conversation_id":"conv_time_to_crawl_scope_20260816","lineage_edge_id":"le_time_boundaries_storage","lineage_id":"lin_time_to_crawl_scope_20260816","lineage_relation_type":"supports","relation_id":"rel_time_to_crawl_boundaries_storage","relation_type":"SUPPORTS","source_ref":"clm_time_to_crawl_boundaries_001","state":"proposed","target_ref":"clm_time_to_crawl_storage_001"},"provenance":{"benchmark_ref":"examples/conversation-lineage/time-to-crawl-v1.json","method":"reconstructed-conversation-lineage-import","ontology_version":"dkg.core@1.x","software_commit":null},"recorded_at":"2026-08-16T00:00:00Z","schema_version":"dkg.event.v1","source_snapshot_refs":["snap_111c06b794cbc9aea14f5868"],"subject_refs":["rel_time_to_crawl_boundaries_storage","clm_time_to_crawl_boundaries_001","clm_time_to_crawl_storage_001"]}
