{"actor":{"actor_id":"time-to-crawl-scope-importer-v1","actor_type":"importer","harness_version":"fossil-core-local-import-v1","model_id":null,"skill_id":"skill_research-ingestion","skill_version":"1.0.0"},"event_id":"evt_fcde7c5e3e25aa1595993d2047d784d2","event_type":"claim.proposed","evidence_refs":["art_3a50d9aab02a8f1765b5b118f6601671"],"idempotency_key":"claim-proposed:lin_time_to_crawl_scope_20260816:ln_time_llm_boundary_001","occurred_at":"2026-08-16T00:00:00Z","pack_id":"pack_time_to_crawl_scope_20260816","payload":{"applicability_scope":{"surface":"inference and execution boundary"},"authority_state":"candidate_only","citation":{"artifact_id":"art_3a50d9aab02a8f1765b5b118f6601671","byte_end":3069,"byte_start":2993,"citation_id":"cite_6190f1a0b6a03432c940e3cb","passage_hash":{"algorithm":"sha256","digest":"1506d277209da141ce74e56e6e707eaf11ccd6e273134c30b6107eef8b11a204"},"schema_version":"fossil.citation.v1","snapshot_id":"snap_111c06b794cbc9aea14f5868"},"claim_text":"LLMs may extract or recommend but deterministic validation and policy authorize","conversation_id":"conv_time_to_crawl_scope_20260816","epistemic_class":"architectural_synthesis","evidence_status":"reconstructed","kind":"decision","lineage_id":"lin_time_to_crawl_scope_20260816","lineage_node_id":"ln_time_llm_boundary_001","operational_state":"proposed","position_state":"current"},"provenance":{"benchmark_ref":"examples/conversation-lineage/time-to-crawl-v1.json","method":"reconstructed-conversation-lineage-import","ontology_version":"dkg.core@1.x","software_commit":null},"recorded_at":"2026-08-16T00:00:00Z","schema_version":"dkg.event.v1","source_snapshot_refs":["snap_111c06b794cbc9aea14f5868"],"subject_refs":["clm_time_to_crawl_llm_boundary_001"]}
