{"actor":{"actor_id":"time-to-crawl-scope-importer-v1","actor_type":"importer","harness_version":"fossil-core-local-import-v1","model_id":null,"skill_id":"skill_research-ingestion","skill_version":"1.0.0"},"event_id":"evt_b629724f288cf537db92372986599624","event_type":"claim.proposed","evidence_refs":["art_3a50d9aab02a8f1765b5b118f6601671"],"idempotency_key":"claim-proposed:lin_time_to_crawl_scope_20260816:ln_time_request_001","occurred_at":"2026-08-16T00:00:00Z","pack_id":"pack_time_to_crawl_scope_20260816","payload":{"authority_state":"candidate_only","citation":{"artifact_id":"art_3a50d9aab02a8f1765b5b118f6601671","byte_end":837,"byte_start":778,"citation_id":"cite_04e33b399ec92cde4a6c7ef3","passage_hash":{"algorithm":"sha256","digest":"e9f0ef9668b386a523efd4fd51d8b0ef1b2e480cf994083319eba55a56a13cd3"},"schema_version":"fossil.citation.v1","snapshot_id":"snap_111c06b794cbc9aea14f5868"},"claim_text":"Ingest the Time to Crawl research into FOSSIL before issue creation","conversation_id":"conv_time_to_crawl_scope_20260816","epistemic_class":"repo_observation","evidence_status":"reconstructed","kind":"question","lineage_id":"lin_time_to_crawl_scope_20260816","lineage_node_id":"ln_time_request_001","position_state":"historical"},"provenance":{"benchmark_ref":"examples/conversation-lineage/time-to-crawl-v1.json","method":"reconstructed-conversation-lineage-import","ontology_version":"dkg.core@1.x","software_commit":null},"recorded_at":"2026-08-16T00:00:00Z","schema_version":"dkg.event.v1","source_snapshot_refs":["snap_111c06b794cbc9aea14f5868"],"subject_refs":["clm_time_to_crawl_request_001"]}
