{"actor":{"actor_id":"time-to-crawl-scope-importer-v1","actor_type":"importer","harness_version":"fossil-core-local-import-v1","model_id":null,"skill_id":"skill_research-ingestion","skill_version":"1.0.0"},"event_id":"evt_2f1a2c1dfa1d948ac82f20b5b052f0ed","event_type":"claim.proposed","evidence_refs":["art_3a50d9aab02a8f1765b5b118f6601671"],"idempotency_key":"claim-proposed:lin_time_to_crawl_scope_20260816:ln_time_scope_guard_001","occurred_at":"2026-08-16T00:00:00Z","pack_id":"pack_time_to_crawl_scope_20260816","payload":{"applicability_scope":{"surface":"crawler security and politeness"},"authority_state":"candidate_only","citation":{"artifact_id":"art_3a50d9aab02a8f1765b5b118f6601671","byte_end":2839,"byte_start":2763,"citation_id":"cite_25780d45a8020dd484d14291","passage_hash":{"algorithm":"sha256","digest":"74c779edd6eba7e835b120aab66998e24b60748d6b7f002e7820ea265c3ed494"},"schema_version":"fossil.citation.v1","snapshot_id":"snap_111c06b794cbc9aea14f5868"},"claim_text":"Deterministic Scope Guard authorizes crawl boundaries before enqueue and execution","conversation_id":"conv_time_to_crawl_scope_20260816","epistemic_class":"architectural_synthesis","evidence_status":"reconstructed","kind":"decision","lineage_id":"lin_time_to_crawl_scope_20260816","lineage_node_id":"ln_time_scope_guard_001","operational_state":"proposed","position_state":"current"},"provenance":{"benchmark_ref":"examples/conversation-lineage/time-to-crawl-v1.json","method":"reconstructed-conversation-lineage-import","ontology_version":"dkg.core@1.x","software_commit":null},"recorded_at":"2026-08-16T00:00:00Z","schema_version":"dkg.event.v1","source_snapshot_refs":["snap_111c06b794cbc9aea14f5868"],"subject_refs":["clm_time_to_crawl_scope_guard_001"]}
