{"actor":{"actor_id":"time-to-crawl-scope-importer-v1","actor_type":"importer","harness_version":"fossil-core-local-import-v1","model_id":null,"skill_id":"skill_research-ingestion","skill_version":"1.0.0"},"event_id":"evt_d8d21b613ebde1d7a1bda960228d5ee4","event_type":"claim.proposed","evidence_refs":["art_3a50d9aab02a8f1765b5b118f6601671"],"idempotency_key":"claim-proposed:lin_time_to_crawl_scope_20260816:ln_time_walking_skeleton_001","occurred_at":"2026-08-16T00:00:00Z","pack_id":"pack_time_to_crawl_scope_20260816","payload":{"applicability_scope":{"surface":"initial delivery method"},"authority_state":"candidate_only","citation":{"artifact_id":"art_3a50d9aab02a8f1765b5b118f6601671","byte_end":4136,"byte_start":4093,"citation_id":"cite_526d4093f23de63be581a081","passage_hash":{"algorithm":"sha256","digest":"352e986c51a7cc4d67f3ff96b493fba48d6b34352315da6c9f949a918327083a"},"schema_version":"fossil.citation.v1","snapshot_id":"snap_111c06b794cbc9aea14f5868"},"claim_text":"Start with a real walking skeleton through every mandatory boundary","conversation_id":"conv_time_to_crawl_scope_20260816","epistemic_class":"architectural_synthesis","evidence_status":"reconstructed","kind":"decision","lineage_id":"lin_time_to_crawl_scope_20260816","lineage_node_id":"ln_time_walking_skeleton_001","operational_state":"proposed","position_state":"current"},"provenance":{"benchmark_ref":"examples/conversation-lineage/time-to-crawl-v1.json","method":"reconstructed-conversation-lineage-import","ontology_version":"dkg.core@1.x","software_commit":null},"recorded_at":"2026-08-16T00:00:00Z","schema_version":"dkg.event.v1","source_snapshot_refs":["snap_111c06b794cbc9aea14f5868"],"subject_refs":["clm_time_to_crawl_walking_skeleton_001"]}
