{"actor":{"actor_id":"fossil-agent-engineering-importer-v1","actor_type":"importer","harness_version":"fossil-core-local-import-v1","model_id":null,"skill_id":"skill_research-ingestion","skill_version":"1.0.0"},"caused_by_event_ids":["evt_2f97ed2b2a3d71045360fcdf8bb3ae8e","evt_32878eea85012eafb061f9841c223d4c"],"event_id":"evt_d6f21e9afdda7b4bb144908bef18a356","event_type":"relation.proposed","evidence_refs":["art_0ec8dbecf87951c91b7f196776a33167"],"idempotency_key":"relation-proposed:lin_fossil_agent_engineering_20260816:le_fossil_planes_evidence","occurred_at":"2026-08-16T00:00:00Z","pack_id":"pack_fossil_agent_engineering_20260816","payload":{"authority_state":"candidate_only","conversation_id":"conv_fossil_agent_engineering_20260816","lineage_edge_id":"le_fossil_planes_evidence","lineage_id":"lin_fossil_agent_engineering_20260816","lineage_relation_type":"supports","relation_id":"rel_fossil_agent_engineering_planes_evidence","relation_type":"SUPPORTS","source_ref":"clm_fossil_agent_engineering_planes_001","state":"proposed","target_ref":"clm_fossil_agent_engineering_evidence_plane_001"},"provenance":{"benchmark_ref":"examples/conversation-lineage/fossil-agent-engineering-substrate-v1.json","method":"reconstructed-conversation-lineage-import","ontology_version":"dkg.core@1.x","software_commit":null},"recorded_at":"2026-08-16T00:00:00Z","schema_version":"dkg.event.v1","source_snapshot_refs":["snap_6b022ba69fa4eb1af63b726c"],"subject_refs":["rel_fossil_agent_engineering_planes_evidence","clm_fossil_agent_engineering_planes_001","clm_fossil_agent_engineering_evidence_plane_001"]}
