{"actor":{"actor_id":"fossil-agent-engineering-importer-v1","actor_type":"importer","harness_version":"fossil-core-local-import-v1","model_id":null,"skill_id":"skill_research-ingestion","skill_version":"1.0.0"},"event_id":"evt_6332de456a138fdbc90605f5b86a9289","event_type":"claim.proposed","evidence_refs":["art_0ec8dbecf87951c91b7f196776a33167"],"idempotency_key":"claim-proposed:lin_fossil_agent_engineering_20260816:ln_fossil_qa_checkpoints_001","occurred_at":"2026-08-16T00:00:00Z","pack_id":"pack_fossil_agent_engineering_20260816","payload":{"applicability_scope":{"surface":"requirements and acceptance"},"authority_state":"candidate_only","citation":{"artifact_id":"art_0ec8dbecf87951c91b7f196776a33167","byte_end":1989,"byte_start":1912,"citation_id":"cite_83193991cade338ffb7100f6","passage_hash":{"algorithm":"sha256","digest":"d4e92475433fa12d68696256b541d662f4c4141faa76d01b3e3c39e6680784ac"},"schema_version":"fossil.citation.v1","snapshot_id":"snap_6b022ba69fa4eb1af63b726c"},"claim_text":"Intent compilation must produce versioned checkpoints and acceptance oracles","conversation_id":"conv_fossil_agent_engineering_20260816","epistemic_class":"architectural_synthesis","evidence_status":"reconstructed","kind":"conclusion","lineage_id":"lin_fossil_agent_engineering_20260816","lineage_node_id":"ln_fossil_qa_checkpoints_001","operational_state":"proposed","position_state":"current"},"provenance":{"benchmark_ref":"examples/conversation-lineage/fossil-agent-engineering-substrate-v1.json","method":"reconstructed-conversation-lineage-import","ontology_version":"dkg.core@1.x","software_commit":null},"recorded_at":"2026-08-16T00:00:00Z","schema_version":"dkg.event.v1","source_snapshot_refs":["snap_6b022ba69fa4eb1af63b726c"],"subject_refs":["clm_fossil_agent_engineering_qa_checkpoints_001"]}
